{
  "schemaVersion": "director.bundle.v1",
  "id": "dimensions-mix-v3",
  "name": "Dimensions mix · v3",
  "revision": 1,
  "composition": {
    "fps": 24,
    "durationFrames": 555,
    "width": 960,
    "height": 540,
    "colorSpace": "srgb",
    "alpha": "straight",
    "background": "#0c0e0c",
    "bpm": 140,
    "beatsPerBar": 4
  },
  "assets": {
    "mix-01": {
      "kind": "video",
      "use": "production",
      "origin": "uploaded",
      "durationSeconds": 13.5,
      "file": {
        "path": "media/mix-01.mp4",
        "sha256": "e7c7afc43122bc5b3947c0651f8c77f9edd38f6684b7ea81c8ef2b95617a1ad7"
      }
    },
    "mix-02": {
      "kind": "video",
      "use": "production",
      "origin": "uploaded",
      "durationSeconds": 13.5,
      "file": {
        "path": "media/mix-02.mp4",
        "sha256": "b749a9b1ede414a9be563d0d9bcd188296a2e97ec688a105b48c1312a2fda4f4"
      }
    },
    "mix-03": {
      "kind": "video",
      "use": "production",
      "origin": "uploaded",
      "durationSeconds": 13.5,
      "file": {
        "path": "media/mix-03.mp4",
        "sha256": "d4bbda0fc4f75bf243827c4b50767d240b8c3cb4c6e9b85bf8d52223a9d6fcf9"
      }
    },
    "mix-track": {
      "kind": "audio",
      "use": "production",
      "origin": "uploaded",
      "durationSeconds": 23.2,
      "file": {
        "path": "media/mix-track.wav",
        "sha256": "3528cd7a7b67732faee0f371bbab89de7952e5c3d06722f4a9490f12f9604286"
      }
    }
  },
  "modules": {
    "end-card": {
      "engine": "animejs",
      "engineVersion": "4.5.0",
      "mode": "overlay",
      "file": {
        "path": "graphics/mix-end-card.mjs",
        "sha256": "de103235d40ca2c883ea05dcff48920b7acf5e74e0252fa9b7ffe7c7b22aa12c"
      },
      "parameterSchema": {
        "type": "object",
        "additionalProperties": false,
        "required": [
          "eyebrow",
          "title",
          "subtitle",
          "credit1",
          "credit2",
          "font",
          "color",
          "accent",
          "steps",
          "done",
          "duration"
        ],
        "properties": {
          "eyebrow": {
            "type": "string",
            "minLength": 0,
            "maxLength": 32,
            "pattern": "^[^\\u0000-\\u001f\\u007f]*$"
          },
          "title": {
            "type": "string",
            "minLength": 1,
            "maxLength": 24,
            "pattern": "^[^\\u0000-\\u001f\\u007f]*$"
          },
          "subtitle": {
            "type": "string",
            "minLength": 0,
            "maxLength": 36,
            "pattern": "^[^\\u0000-\\u001f\\u007f]*$"
          },
          "credit1": {
            "type": "string",
            "minLength": 0,
            "maxLength": 50,
            "pattern": "^[^\\u0000-\\u001f\\u007f]*$"
          },
          "credit2": {
            "type": "string",
            "minLength": 0,
            "maxLength": 50,
            "pattern": "^[^\\u0000-\\u001f\\u007f]*$"
          },
          "font": {
            "type": "string",
            "minLength": 1,
            "maxLength": 120,
            "pattern": "^[A-Za-z0-9 ,\"'-]+$"
          },
          "color": { "type": "string", "pattern": "^#[0-9a-fA-F]{6}$" },
          "accent": { "type": "string", "pattern": "^#[0-9a-fA-F]{6}$" },
          "steps": {
            "type": "string",
            "minLength": 0,
            "maxLength": 160,
            "pattern": "^[^\\u0000-\\u001f\\u007f]*$"
          },
          "done": {
            "type": "string",
            "minLength": 0,
            "maxLength": 40,
            "pattern": "^[^\\u0000-\\u001f\\u007f]*$"
          },
          "duration": { "type": "number", "minimum": 1, "maximum": 8 }
        }
      }
    },
    "wire-scan": {
      "engine": "threejs",
      "engineVersion": "0.180.0",
      "mode": "filter",
      "file": {
        "path": "graphics/mix-wire-scan.mjs",
        "sha256": "ea23e0a7b8f48a503a65f2e316a612582a489a6eaf14aa8476950eca4bf4b117"
      },
      "parameterSchema": {
        "type": "object",
        "additionalProperties": false,
        "required": ["color", "amount", "sweep", "trail"],
        "properties": {
          "color": { "type": "string", "pattern": "^#[0-9a-fA-F]{6}$" },
          "amount": { "type": "number", "minimum": 0, "maximum": 1 },
          "sweep": { "type": "number", "minimum": 0.1, "maximum": 8 },
          "trail": { "type": "number", "minimum": 0.05, "maximum": 1 }
        }
      }
    },
    "slice-glitch": {
      "engine": "threejs",
      "engineVersion": "0.180.0",
      "mode": "filter",
      "file": {
        "path": "graphics/mix-slice-glitch.mjs",
        "sha256": "f1e5a045aae8ae9bc1b7691cd939c783cd078864c9ca7f945f85a17d7ccbb588"
      },
      "parameterSchema": {
        "type": "object",
        "additionalProperties": false,
        "required": ["amount", "slices", "seed", "duration"],
        "properties": {
          "amount": { "type": "number", "minimum": 0, "maximum": 1 },
          "slices": { "type": "integer", "minimum": 2, "maximum": 64 },
          "seed": { "type": "integer", "minimum": 0, "maximum": 9999 },
          "duration": { "type": "number", "minimum": 0.02, "maximum": 2 }
        }
      }
    },
    "hud": {
      "engine": "animejs",
      "engineVersion": "4.5.0",
      "mode": "overlay",
      "file": {
        "path": "graphics/mix-hud.mjs",
        "sha256": "623ccbbb6058884a5687b7d84b5e3c57cbcba11859ccb8642c6831c6957d4e2e"
      },
      "parameterSchema": {
        "type": "object",
        "additionalProperties": false,
        "required": ["color", "accent", "bpm", "text", "credit", "seconds"],
        "properties": {
          "color": { "type": "string", "pattern": "^#[0-9a-fA-F]{6}$" },
          "accent": { "type": "string", "pattern": "^#[0-9a-fA-F]{6}$" },
          "bpm": { "type": "number", "minimum": 20, "maximum": 300 },
          "text": {
            "type": "string",
            "minLength": 0,
            "maxLength": 60,
            "pattern": "^[^\\u0000-\\u001f\\u007f]*$"
          },
          "credit": {
            "type": "string",
            "minLength": 0,
            "maxLength": 60,
            "pattern": "^[^\\u0000-\\u001f\\u007f]*$"
          },
          "seconds": { "type": "number", "minimum": 1, "maximum": 120 }
        }
      }
    },
    "screen-open": {
      "engine": "animejs",
      "engineVersion": "4.5.0",
      "mode": "overlay",
      "file": {
        "path": "graphics/mix-screen-open.mjs",
        "sha256": "396bf3dab13d4f83f60a9790251dcf64cbb632e55b19d651169d70aba886e209"
      },
      "parameterSchema": {
        "type": "object",
        "additionalProperties": false,
        "required": ["color", "matte", "duration", "glyphs", "seed"],
        "properties": {
          "color": { "type": "string", "pattern": "^#[0-9a-fA-F]{6}$" },
          "matte": { "type": "string", "pattern": "^#[0-9a-fA-F]{6}$" },
          "duration": { "type": "number", "minimum": 0.1, "maximum": 8 },
          "glyphs": { "type": "integer", "minimum": 0, "maximum": 64 },
          "seed": { "type": "integer", "minimum": 0, "maximum": 9999 }
        }
      }
    },
    "build-panel": {
      "engine": "animejs",
      "engineVersion": "4.5.0",
      "mode": "overlay",
      "file": {
        "path": "graphics/mix-build-panel.mjs",
        "sha256": "54c341f37a896d90bdd05e5b854671b5ca90962c65d8a98660cd15cda699beb6"
      },
      "parameterSchema": {
        "type": "object",
        "additionalProperties": false,
        "required": [
          "side",
          "title",
          "lines",
          "color",
          "muted",
          "accent",
          "bpm",
          "duration"
        ],
        "properties": {
          "side": { "type": "string", "enum": ["left", "right"] },
          "title": {
            "type": "string",
            "minLength": 1,
            "maxLength": 40,
            "pattern": "^[^\\u0000-\\u001f\\u007f]*$"
          },
          "lines": {
            "type": "string",
            "minLength": 0,
            "maxLength": 200,
            "pattern": "^[^\\u0000-\\u001f\\u007f]*$"
          },
          "color": { "type": "string", "pattern": "^#[0-9a-fA-F]{6}$" },
          "muted": { "type": "string", "pattern": "^#[0-9a-fA-F]{6}$" },
          "accent": { "type": "string", "pattern": "^#[0-9a-fA-F]{6}$" },
          "bpm": { "type": "number", "minimum": 20, "maximum": 300 },
          "duration": { "type": "number", "minimum": 0.2, "maximum": 8 }
        }
      }
    },
    "scan": {
      "engine": "animejs",
      "engineVersion": "4.5.0",
      "mode": "overlay",
      "file": {
        "path": "graphics/mix-scan.mjs",
        "sha256": "c55f2da9c34a8064758db970ca3f9f664bc22cf2be9f0c04707f2f09d8d20b50"
      },
      "parameterSchema": {
        "type": "object",
        "additionalProperties": false,
        "required": ["color", "accent", "text", "x", "y", "bpm"],
        "properties": {
          "color": { "type": "string", "pattern": "^#[0-9a-fA-F]{6}$" },
          "accent": { "type": "string", "pattern": "^#[0-9a-fA-F]{6}$" },
          "text": {
            "type": "string",
            "minLength": 1,
            "maxLength": 32,
            "pattern": "^[^\\u0000-\\u001f\\u007f]*$"
          },
          "x": { "type": "number", "minimum": 0, "maximum": 1 },
          "y": { "type": "number", "minimum": 0, "maximum": 1 },
          "bpm": { "type": "number", "minimum": 20, "maximum": 300 }
        }
      }
    },
    "kinetic": {
      "engine": "animejs",
      "engineVersion": "4.5.0",
      "mode": "overlay",
      "file": {
        "path": "graphics/mix-kinetic.mjs",
        "sha256": "5352245651b8f5d1b2bb194326eead422ba7afe0c03bac6576b69d6ba4a9a50e"
      },
      "parameterSchema": {
        "type": "object",
        "additionalProperties": false,
        "required": [
          "text",
          "font",
          "weight",
          "color",